Subcategory,ICC (Intraclass Correlation Coefficient),ICC 95% Confidence Interval,Transitivity Consistency Ratio (%)
Topic Relevance,0.1498585911204555,[0.08 0.24],65.71428571428571
Comprehensiveness of Information,0.2384991808495277,[0.16 0.35],67.08860759493672
Accuracy of Information,0.1506208180763325,[0.08 0.25],57.99999999999999
Innovativeness of Viewpoints,0.25666559520439025,[0.17 0.37],79.13043478260869
Integration of Interdisciplinary Perspectives,0.14971504291358517,[0.08 0.24],70.47619047619048
Clarity of Logical Structure,0.1348724584313219,[0.07 0.22],70.0
Reasonableness of Chapter Arrangement,0.1524348620169297,[0.09 0.25],64.03508771929825
Quality of Introduction and Conclusion,0.14004021305248518,[0.08 0.23],66.39344262295081
Accuracy and Completeness of Citations,0.12020912239991519,[0.06 0.21],54.054054054054056
Timeliness and Relevance of References,0.17902743904565782,[0.11 0.28],67.67676767676768
Avoidance of Plagiarism and Appropriate Citation,0.10073079709902706,[0.05 0.18],70.10309278350515
Critical Analysis of Existing Research,0.2361643670179041,[0.15 0.35],78.76712328767124
Proposal of New Research Directions or Questions,0.1871023842083358,[0.11 0.29],78.35820895522389
Potential Contribution to the Field,0.23868984890979672,[0.16 0.35],78.80794701986756
Clarity of Research Method Description,0.14562511894184949,[0.08 0.24],74.50980392156863
Rationality of Method Selection,0.15821368445887585,[0.09 0.25],72.11538461538461
Rigor of Research Design,0.14690761788951584,[0.08 0.24],72.56637168141593
Inclusion of Latest Research Results,0.19873841907229575,[0.12 0.3 ],67.0
Reflection of Current Research Hotspots,0.19241705734287565,[0.12 0.3 ],74.54545454545455
Fluency of Language Expression,0.11710171741786522,[0.06 0.2 ],71.63120567375887
Appropriateness of Professional Terminology Use,0.12689871481756765,[0.07 0.22],64.86486486486487
Conciseness of Expression,0.11198798774970209,[0.05 0.2 ],65.74074074074075
Practical Application Potential of Research Results,0.21019561012150748,[0.13 0.32],67.61904761904762
Feasibility of Proposed Suggestions,0.16913084479937024,[0.1  0.27],74.4186046511628
Logic of Argumentation,0.1565441986690757,[0.09 0.25],69.29133858267717
Multi-angle Analysis of Problems,0.17692856867434956,[0.11 0.28],69.06474820143885
Identification and Discussion of Research Limitations,0.16261222906566844,[0.09 0.26],64.70588235294117
