Subcategory,ICC (Intraclass Correlation Coefficient),ICC 95% Confidence Interval,Transitivity Consistency Ratio (%)
Topic Relevance,0.0663253070343365,[0.02 0.14],67.85714285714286
Comprehensiveness of Information,0.10132106966370276,[0.05 0.19],71.29629629629629
Accuracy of Information,0.06326306185953312,[0.02 0.14],55.81395348837209
Innovativeness of Viewpoints,0.06443176522042739,[0.02 0.14],77.89473684210526
Integration of Interdisciplinary Perspectives,0.018656621596754304,[-0.02  0.08],72.05882352941177
Clarity of Logical Structure,0.06322521124185633,[0.02 0.13],90.0
Reasonableness of Chapter Arrangement,0.061436240132423034,[0.02 0.13],72.38095238095238
Quality of Introduction and Conclusion,0.048579790576285926,[0.   0.12],69.90291262135922
Accuracy and Completeness of Citations,0.08860457251740998,[0.04 0.17],76.04166666666666
Timeliness and Relevance of References,0.1250935048130989,[0.06 0.22],72.58064516129032
Avoidance of Plagiarism and Appropriate Citation,0.03672646844507077,[-0.   0.1],73.80952380952381
Critical Analysis of Existing Research,0.0818823712941695,[0.03 0.16],72.88135593220339
Proposal of New Research Directions or Questions,0.058962001556407885,[0.01 0.13],79.25925925925927
Potential Contribution to the Field,0.050101429761145067,[0.01 0.12],71.7948717948718
Clarity of Research Method Description,0.04678756290474752,[0.   0.11],72.44094488188976
Rationality of Method Selection,0.04537769899855382,[0.   0.11],83.33333333333334
Rigor of Research Design,0.038525271828331625,[-0.   0.1],75.1937984496124
Inclusion of Latest Research Results,0.09285174495361057,[0.04 0.17],75.63025210084034
Reflection of Current Research Hotspots,0.09985259458252722,[0.04 0.18],75.21367521367522
Fluency of Language Expression,0.06789259410666165,[0.02 0.14],63.63636363636363
Appropriateness of Professional Terminology Use,0.05041262626748969,[0.01 0.12],76.14678899082568
Conciseness of Expression,0.05403406452666331,[0.01 0.12],77.04918032786885
Practical Application Potential of Research Results,0.06437428129110016,[0.02 0.14],76.85185185185185
Feasibility of Proposed Suggestions,0.06211173492856086,[0.01 0.14],73.64341085271317
Logic of Argumentation,0.05963889550722782,[0.01 0.13],69.52380952380952
Multi-angle Analysis of Problems,0.046152179620295934,[0.   0.11],76.42276422764228
Identification and Discussion of Research Limitations,0.04608525851495219,[0.   0.11],75.0
