Subcategory,ICC (Intraclass Correlation Coefficient),ICC 95% Confidence Interval,Transitivity Consistency Ratio (%)
Topic Relevance,0.012487895489022198,[-0.02  0.07],26.666666666666668
Comprehensiveness of Information,0.12918499059591312,[0.07 0.22],42.857142857142854
Accuracy of Information,0.10139095345414581,[0.05 0.19],27.27272727272727
Innovativeness of Viewpoints,0.10752020336975594,[0.05 0.19],63.51351351351351
Integration of Interdisciplinary Perspectives,0.050345839752042175,[0.01 0.12],47.27272727272727
Clarity of Logical Structure,-0.003570847177344302,[-0.02  0.03],94.63087248322147
Reasonableness of Chapter Arrangement,-0.00442182022800163,[-0.03  0.03],91.13924050632912
Quality of Introduction and Conclusion,0.01707176787648652,[-0.02  0.07],79.82456140350878
Accuracy and Completeness of Citations,0.02575873525857657,[-0.01  0.08],95.65217391304348
Timeliness and Relevance of References,0.052855026221706014,[0.01 0.12],91.22807017543859
Avoidance of Plagiarism and Appropriate Citation,0.01653040068934787,[-0.02  0.07],83.60655737704919
Critical Analysis of Existing Research,0.13414553151289743,[0.07 0.23],79.64601769911505
Proposal of New Research Directions or Questions,0.19977942006348953,[0.12 0.31],81.10236220472441
Potential Contribution to the Field,0.11719706280687113,[0.06 0.21],82.39999999999999
Clarity of Research Method Description,-0.0060814651990444574,[-0.03  0.03],89.87341772151899
Rationality of Method Selection,0.0018809453689597679,[-0.02  0.04],81.06060606060606
Rigor of Research Design,0.009260099614517195,[-0.02  0.06],88.09523809523809
Inclusion of Latest Research Results,0.05137294539830272,[0.01 0.12],87.59124087591242
Reflection of Current Research Hotspots,0.07069698702761518,[0.02 0.15],85.12396694214877
Fluency of Language Expression,0.016659275127394155,[-0.02  0.07],79.20792079207921
Appropriateness of Professional Terminology Use,0.013868408423755531,[-0.02  0.06],88.52459016393442
Conciseness of Expression,-0.0059427461499329415,[-0.03  0.03],88.28125
Practical Application Potential of Research Results,0.058967919202063776,[0.02 0.13],90.15151515151516
Feasibility of Proposed Suggestions,0.07338398548293636,[0.03 0.15],83.82352941176471
Logic of Argumentation,0.046033160269947235,[0.01 0.11],87.96992481203007
Multi-angle Analysis of Problems,0.04879296645001229,[0.01 0.12],86.02941176470588
Identification and Discussion of Research Limitations,0.05932466875254743,[0.01 0.13],85.8267716535433
