Subcategory,ICC (Intraclass Correlation Coefficient),ICC 95% Confidence Interval,Transitivity Consistency Ratio (%)
Topic Relevance,0.48876642029500034,[0.39 0.6 ],54.285714285714285
Comprehensiveness of Information,0.6306940131889867,[0.48 0.75],90.9090909090909
Accuracy of Information,0.16650246305418728,[0.1  0.27],30.0
Innovativeness of Viewpoints,0.6053640312768955,[0.47 0.73],90.30303030303031
Integration of Interdisciplinary Perspectives,0.6466096096760934,[0.54 0.75],87.42138364779875
Clarity of Logical Structure,0.5810938608311551,[0.46 0.7 ],84.24242424242424
Reasonableness of Chapter Arrangement,0.5794612788996731,[0.46 0.7 ],90.30303030303031
Quality of Introduction and Conclusion,0.5638627186283545,[0.45 0.68],88.48484848484848
Accuracy and Completeness of Citations,0.6885619534406747,[0.6  0.78],61.111111111111114
Timeliness and Relevance of References,0.5850484735337526,[0.47 0.7 ],84.71337579617835
Avoidance of Plagiarism and Appropriate Citation,0.1475390583212015,[0.08 0.24],53.333333333333336
Critical Analysis of Existing Research,0.5984753468556709,[0.46 0.72],88.48484848484848
Proposal of New Research Directions or Questions,0.6762152197446051,[0.57 0.77],86.06060606060606
Potential Contribution to the Field,0.6045073484772131,[0.48 0.72],87.87878787878788
Clarity of Research Method Description,0.5378399194472611,[0.4  0.67],80.76923076923077
Rationality of Method Selection,0.5519893135384811,[0.42 0.68],82.6923076923077
Rigor of Research Design,0.5048530005676453,[0.37 0.64],82.42424242424242
Inclusion of Latest Research Results,0.5949700670719315,[0.48 0.71],84.71337579617835
Reflection of Current Research Hotspots,0.5907984740934525,[0.48 0.7 ],76.96969696969697
Fluency of Language Expression,0.43059884746491683,[0.32 0.56],84.24242424242424
Appropriateness of Professional Terminology Use,0.3457477321748175,[0.23 0.48],92.72727272727272
Conciseness of Expression,0.3894242785828903,[0.28 0.52],87.82051282051282
Practical Application Potential of Research Results,0.579871240338345,[0.45 0.7 ],87.87878787878788
Feasibility of Proposed Suggestions,0.5616343802049728,[0.43 0.68],85.45454545454545
Logic of Argumentation,0.5583139450975619,[0.43 0.68],84.24242424242424
Multi-angle Analysis of Problems,0.6018481294427961,[0.49 0.71],85.8974358974359
Identification and Discussion of Research Limitations,0.5263220822346298,[0.4  0.65],90.30303030303031
