Subcategory,ICC (Intraclass Correlation Coefficient),ICC 95% Confidence Interval,Transitivity Consistency Ratio (%)
Topic Relevance,0.4476179679265634,[0.35 0.57],61.53846153846154
Comprehensiveness of Information,0.726112843912667,[0.64 0.81],81.81818181818183
Accuracy of Information,0.3569998128061766,[0.26 0.48],48.484848484848484
Innovativeness of Viewpoints,0.7279352032553891,[0.64 0.81],86.66666666666667
Integration of Interdisciplinary Perspectives,0.7630566093425957,[0.69 0.83],82.16560509554141
Clarity of Logical Structure,0.7844092671000266,[0.71 0.85],77.57575757575758
Reasonableness of Chapter Arrangement,0.7431867095275266,[0.66 0.82],78.78787878787878
Quality of Introduction and Conclusion,0.687641532630703,[0.6  0.78],78.78787878787878
Accuracy and Completeness of Citations,0.6941756964140283,[0.61 0.78],58.82352941176471
Timeliness and Relevance of References,0.6410766693436442,[0.55 0.74],73.125
Avoidance of Plagiarism and Appropriate Citation,0.3515320601748861,[0.26 0.47],59.375
Critical Analysis of Existing Research,0.7441355717472624,[0.66 0.82],86.06060606060606
Proposal of New Research Directions or Questions,0.7878836985185398,[0.72 0.85],84.84848484848484
Potential Contribution to the Field,0.7667820620103015,[0.69 0.84],84.84848484848484
Clarity of Research Method Description,0.6409501301910856,[0.55 0.74],78.48101265822784
Rationality of Method Selection,0.6639285869047102,[0.57 0.76],74.54545454545455
Rigor of Research Design,0.6015778865846367,[0.5 0.7],78.48101265822784
Inclusion of Latest Research Results,0.6685587341188423,[0.58 0.76],73.75
Reflection of Current Research Hotspots,0.6982977408680485,[0.61 0.78],76.31578947368422
Fluency of Language Expression,0.6304732202294145,[0.53 0.73],77.57575757575758
Appropriateness of Professional Terminology Use,0.5543372931800153,[0.45 0.66],73.68421052631578
Conciseness of Expression,0.6108523818897351,[0.51 0.71],78.78787878787878
Practical Application Potential of Research Results,0.7479173607257366,[0.67 0.82],82.42424242424242
Feasibility of Proposed Suggestions,0.7069117665435692,[0.62 0.79],82.42424242424242
Logic of Argumentation,0.7394155437805872,[0.66 0.82],82.42424242424242
Multi-angle Analysis of Problems,0.7532352615469745,[0.68 0.83],80.0
Identification and Discussion of Research Limitations,0.6790078995006471,[0.59 0.77],84.24242424242424
