Subcategory,ICC (Intraclass Correlation Coefficient),ICC 95% Confidence Interval,Transitivity Consistency Ratio (%)
Topic Relevance,0.5496408411478616,[0.45 0.66],65.21739130434783
Comprehensiveness of Information,0.7587486633658692,[0.66 0.84],87.89808917197452
Accuracy of Information,0.24218278567118348,[0.16 0.35],83.33333333333334
Innovativeness of Viewpoints,0.6581648352156191,[0.55 0.76],84.27672955974843
Integration of Interdisciplinary Perspectives,0.7532514245006917,[0.67 0.83],83.54430379746836
Clarity of Logical Structure,0.702827179526717,[0.61 0.79],86.57718120805369
Reasonableness of Chapter Arrangement,0.7238364303890528,[0.64 0.8 ],87.27272727272727
Quality of Introduction and Conclusion,0.6552713124776007,[0.56 0.75],87.27272727272727
Accuracy and Completeness of Citations,0.7443682488279858,[0.66 0.82],63.829787234042556
Timeliness and Relevance of References,0.7298932030700465,[0.65 0.81],84.24242424242424
Avoidance of Plagiarism and Appropriate Citation,0.30408132224892237,[0.21 0.42],70.58823529411765
Critical Analysis of Existing Research,0.6567929426884136,[0.55 0.76],87.87878787878788
Proposal of New Research Directions or Questions,0.73588098636326,[0.65 0.81],85.45454545454545
Potential Contribution to the Field,0.6993735814498215,[0.6  0.79],86.06060606060606
Clarity of Research Method Description,0.5694702924756514,[0.46 0.68],87.87878787878788
Rationality of Method Selection,0.6024539058327617,[0.5  0.71],84.24242424242424
Rigor of Research Design,0.543109078038136,[0.43 0.66],84.61538461538461
Inclusion of Latest Research Results,0.7353966494917563,[0.65 0.81],84.24242424242424
Reflection of Current Research Hotspots,0.7111220447292183,[0.62 0.79],81.81818181818183
Fluency of Language Expression,0.5273204883644778,[0.42 0.64],89.6969696969697
Appropriateness of Professional Terminology Use,0.4931241529538001,[0.38 0.62],80.82191780821918
Conciseness of Expression,0.5394244629223386,[0.43 0.65],88.48484848484848
Practical Application Potential of Research Results,0.6840827185424031,[0.58 0.78],85.45454545454545
Feasibility of Proposed Suggestions,0.6424123924427175,[0.54 0.74],86.06060606060606
Logic of Argumentation,0.635405804580924,[0.53 0.74],85.23489932885906
Multi-angle Analysis of Problems,0.6779035101732213,[0.58 0.77],84.84848484848484
Identification and Discussion of Research Limitations,0.6037957494087828,[0.49 0.71],87.17948717948718
