Subcategory,ICC (Intraclass Correlation Coefficient),ICC 95% Confidence Interval,Transitivity Consistency Ratio (%)
Topic Relevance,0.3374603495302556,[0.24 0.46],65.4320987654321
Comprehensiveness of Information,0.7755888435808496,[0.68 0.85],86.66666666666667
Accuracy of Information,0.23444211782894164,[0.15 0.34],36.0
Innovativeness of Viewpoints,0.7509728370788884,[0.66 0.83],86.06060606060606
Integration of Interdisciplinary Perspectives,0.7509903948844683,[0.67 0.82],85.45454545454545
Clarity of Logical Structure,0.7142870900461703,[0.63 0.8 ],80.12820512820514
Reasonableness of Chapter Arrangement,0.7096356217166176,[0.62 0.79],83.03030303030303
Quality of Introduction and Conclusion,0.6464446079713655,[0.55 0.74],83.03030303030303
Accuracy and Completeness of Citations,0.7707292934291383,[0.7  0.84],56.25
Timeliness and Relevance of References,0.696445130832715,[0.61 0.78],84.84848484848484
Avoidance of Plagiarism and Appropriate Citation,0.21727616110458786,[0.14 0.33],51.42857142857142
Critical Analysis of Existing Research,0.7532722162773251,[0.67 0.83],86.06060606060606
Proposal of New Research Directions or Questions,0.7988349070837382,[0.73 0.86],84.24242424242424
Potential Contribution to the Field,0.73903989058652,[0.66 0.82],84.24242424242424
Clarity of Research Method Description,0.6617424329048044,[0.57 0.75],83.97435897435898
Rationality of Method Selection,0.6780748720399358,[0.59 0.77],85.45454545454545
Rigor of Research Design,0.6338665131163246,[0.54 0.73],85.44303797468355
Inclusion of Latest Research Results,0.7030337311466253,[0.62 0.79],84.84848484848484
Reflection of Current Research Hotspots,0.7052400151970748,[0.62 0.79],85.45454545454545
Fluency of Language Expression,0.475920691395018,[0.37 0.59],85.45454545454545
Appropriateness of Professional Terminology Use,0.44358085823958215,[0.34 0.56],87.17948717948718
Conciseness of Expression,0.4802780316126225,[0.38 0.6 ],84.27672955974843
Practical Application Potential of Research Results,0.721438604333236,[0.63 0.8 ],84.24242424242424
Feasibility of Proposed Suggestions,0.6853001464407392,[0.59 0.77],84.84848484848484
Logic of Argumentation,0.675595315741259,[0.58 0.77],85.45454545454545
Multi-angle Analysis of Problems,0.7040118469532478,[0.62 0.79],84.61538461538461
Identification and Discussion of Research Limitations,0.6366876130824505,[0.54 0.74],84.24242424242424
