Subcategory,ICC (Intraclass Correlation Coefficient),ICC 95% Confidence Interval,Transitivity Consistency Ratio (%)
Topic Relevance,0.4345283771961064,[0.33 0.55],63.07692307692307
Comprehensiveness of Information,0.7322668915013283,[0.63 0.82],82.42424242424242
Accuracy of Information,0.29863258086424155,[0.21 0.42],45.16129032258064
Innovativeness of Viewpoints,0.6161538945882314,[0.48 0.73],85.62091503267973
Integration of Interdisciplinary Perspectives,0.714432070219416,[0.63 0.8 ],77.57575757575758
Clarity of Logical Structure,0.7135972693316833,[0.63 0.8 ],86.62420382165605
Reasonableness of Chapter Arrangement,0.689794830356471,[0.6  0.78],77.07006369426752
Quality of Introduction and Conclusion,0.6165425666258195,[0.52 0.72],82.27848101265823
Accuracy and Completeness of Citations,0.6447663351018327,[0.55 0.74],59.183673469387756
Timeliness and Relevance of References,0.6290473544745082,[0.53 0.73],88.46153846153845
Avoidance of Plagiarism and Appropriate Citation,0.23837620825771677,[0.16 0.35],50.0
Critical Analysis of Existing Research,0.6583248142909285,[0.54 0.76],85.09316770186336
Proposal of New Research Directions or Questions,0.6622215258297433,[0.56 0.76],87.82051282051282
Potential Contribution to the Field,0.6118899019247037,[0.51 0.72],85.43046357615894
Clarity of Research Method Description,0.5342346496029459,[0.43 0.65],82.38993710691824
Rationality of Method Selection,0.5584335088477225,[0.46 0.67],75.15151515151514
Rigor of Research Design,0.5409254117289253,[0.44 0.65],78.78787878787878
Inclusion of Latest Research Results,0.6279544082191341,[0.53 0.73],88.46153846153845
Reflection of Current Research Hotspots,0.6312688716161938,[0.54 0.73],82.42424242424242
Fluency of Language Expression,0.5243710181260787,[0.42 0.64],85.45454545454545
Appropriateness of Professional Terminology Use,0.5393316510928657,[0.44 0.65],78.343949044586
Conciseness of Expression,0.5309098645746649,[0.43 0.64],79.74683544303798
Practical Application Potential of Research Results,0.5274010322371698,[0.42 0.64],86.53846153846155
Feasibility of Proposed Suggestions,0.5064105189500917,[0.4  0.62],82.42424242424242
Logic of Argumentation,0.6461539065746201,[0.55 0.74],83.03030303030303
Multi-angle Analysis of Problems,0.6493606192379692,[0.55 0.75],78.78787878787878
Identification and Discussion of Research Limitations,0.5154203069781601,[0.41 0.63],84.84848484848484
