Subcategory,ICC (Intraclass Correlation Coefficient),ICC 95% Confidence Interval,Transitivity Consistency Ratio (%)
Topic Relevance,0.6593202524408204,[0.57 0.75],64.38356164383562
Comprehensiveness of Information,0.8372583906007625,[0.78 0.89],82.42424242424242
Accuracy of Information,0.41402567727323814,[0.31 0.53],35.483870967741936
Innovativeness of Viewpoints,0.7769542934367117,[0.7  0.85],80.89171974522293
Integration of Interdisciplinary Perspectives,0.8254826898102848,[0.76 0.88],85.45454545454545
Clarity of Logical Structure,0.7885192964844482,[0.72 0.85],87.27272727272727
Reasonableness of Chapter Arrangement,0.7902626268756356,[0.72 0.85],88.48484848484848
Quality of Introduction and Conclusion,0.7328921195273705,[0.65 0.81],87.27272727272727
Accuracy and Completeness of Citations,0.779448423943787,[0.71 0.85],57.14285714285714
Timeliness and Relevance of References,0.748736099271789,[0.67 0.82],85.45454545454545
Avoidance of Plagiarism and Appropriate Citation,0.4701841578711726,[0.37 0.59],48.07692307692308
Critical Analysis of Existing Research,0.7932371643314005,[0.72 0.86],81.875
Proposal of New Research Directions or Questions,0.849253565014524,[0.79 0.9 ],86.06060606060606
Potential Contribution to the Field,0.798964736935303,[0.73 0.86],87.27272727272727
Clarity of Research Method Description,0.7162713747796592,[0.63 0.8 ],77.9874213836478
Rationality of Method Selection,0.7190326286472944,[0.63 0.8 ],79.61783439490446
Rigor of Research Design,0.6894846312380171,[0.6  0.78],78.48101265822784
Inclusion of Latest Research Results,0.769125298690244,[0.69 0.84],85.45454545454545
Reflection of Current Research Hotspots,0.7578035038837091,[0.68 0.83],82.91139240506328
Fluency of Language Expression,0.5323150003580785,[0.43 0.64],85.45454545454545
Appropriateness of Professional Terminology Use,0.509736160622884,[0.41 0.62],80.60606060606061
Conciseness of Expression,0.5069394225895706,[0.4  0.62],83.66013071895425
Practical Application Potential of Research Results,0.7691363345577303,[0.69 0.84],86.66666666666667
Feasibility of Proposed Suggestions,0.7598291060057445,[0.68 0.83],85.45454545454545
Logic of Argumentation,0.7772360592584441,[0.7  0.84],85.45454545454545
Multi-angle Analysis of Problems,0.7918830498900932,[0.72 0.86],86.66666666666667
Identification and Discussion of Research Limitations,0.7044967318975435,[0.62 0.79],86.66666666666667
